{
  "os": {
    "family": "Windows",
    "version": "2009",
    "build": "26100",
    "kernel": "Windows 10 Pro",
    "edition": "Pro",
    "architecture": "x64"
  },
  "cpu": {
    "model": "13th Gen Intel(R) Core(TM) i9-13900HX",
    "cores_logical": 32,
    "cores_physical": 24,
    "max_clock_mhz": 2200,
    "cache_l3_kb": null,
    "manufacturer": "GenuineIntel"
  },
  "memory": {
    "total_bytes": 34074263552,
    "available_bytes": null,
    "modules": []
  },
  "storage": [],
  "gpu": [],
  "network": {
    "hostname": "redacted-host",
    "ipv4": [],
    "ipv6": [],
    "proxy": null,
    "vpn": null,
    "dns_servers": [],
    "domain_joined": false
  },
  "security": {
    "tmp_present": null,
    "tmp_version": null,
    "secure_boot": null,
    "defender_enabled": null,
    "firewall_domain": null,
    "firewall_private": null,
    "firewall_public": null,
    "bitlocker_enabled": null,
    "uac_enabled": null
  },
  "toolchain": {
    "claude_code": null,
    "git": "git version 2.47.0.windows.2",
    "python": "Python 3.13.1",
    "uv": "uv 0.5.4",
    "node": "v20.18.0",
    "npm": "10.8.2",
    "pnpm": null,
    "yarn": null,
    "bun": null,
    "go": null,
    "rust": null,
    "cargo": null,
    "docker": null,
    "kubectl": null,
    "terraform": null,
    "powershell": "5.1.26100.2161"
  },
  "timestamps": {
    "collected_at": "2025-01-27T14:30:00Z",
    "collector_version": "rep-pada-enhanced-v1.0.0",
    "uptime_seconds": null
  },
  "governance_metadata": {
    "profile_version": "1.0.0",
    "compatibility_level": "claude-code-optimized",
    "agent_orchestration_ready": true,
    "rep_pada_compatible": true
  }
}
